# Bluetooth Gadget Template

attrs: 
{
    bcdUSB = 0x200;
    bDeviceClass = 0xE0;  # Wireless Controller
    bDeviceSubClass = 0x01;  # RF Controller
    bDeviceProtocol = 0x01;  # Bluetooth programming
    bMaxPacketSize0 = 0x40;
    idVendor = 0x1D6B;
    idProduct = 0x104;
    bcdDevice = 0x1;
};

os_descs: 
{
    use = 0;
    qw_sign = "";
    b_vendor_code = 0x0;
};

strings = ( 
    {
        lang = 0x409;
        manufacturer = "Your Manufacturer";
        product = "Your Bluetooth Gadget";
        serialnumber = "123456789";
    } );

functions: 
{
    bluetooth_usb0: 
    {
        instance = "usb0";
        type = "bluetooth";
        attrs: 
        {
            address = "00:11:22:33:44:55";  # Set your Bluetooth address
        };
        os_descs = ( );
    };
};

configs = ( 
    {
        id = 1;
        name = "The only one";
        attrs: 
        {
            bmAttributes = 0x80;
            bMaxPower = 0x2;
        };
        strings = ( 
            {
                lang = 0x409;
                configuration = "1xBluetooth";
            } );
        functions = ( 
            {
                name = "bluetooth_usb0";
                function = "bluetooth_usb0";
            } );
    } );
