attrs : 
{
    bcdUSB = 0x200;
    bDeviceClass = 0x0;
    bDeviceSubClass = 0x0;
    bDeviceProtocol = 0x0;
    bMaxPacketSize0 = 0x40;
    idVendor = 0x1D6B;
    idProduct = 0x104;
    bcdDevice = 0x1;
};
os_descs : 
{
    use = 0;
    qw_sign = "";
    b_vendor_code = 0x0;
};
strings = ( 
    {
        lang = 0x409;
        manufacturer = "Foo Inc.";
        product = "Bar Gadget";
        serialnumber = "0123456789";
    } );
functions : 
{
    midi_usb0 : 
    {
        instance = "usb0";
        type = "midi";
        attrs : 
        {
            index = 0;
            id = "usb0";
            in_ports = 2;
            out_ports = 3;
            buflen = 128;
            qlen = 16;
        };
        os_descs = ( );
    };
};
configs = ( 
    {
        id = 1;
        name = "The only one";
        attrs : 
        {
            bmAttributes = 0x80;
            bMaxPower = 0x2;
        };
        strings = ( 
            {
                lang = 0x409;
                configuration = "1xMIDI";
            } );
        functions = ( 
            {
                name = "some_name";
                function = "midi_usb0";
            } );
    } );
