attrs : 
{
    bcdUSB = 0x200;
    bDeviceClass = 0x0;
    bDeviceSubClass = 0x0;
    bDeviceProtocol = 0x0;
    bMaxPacketSize0 = 0x40;
    idVendor = 0x1D6B;
    idProduct = 0x104;
    bcdDevice = 0x1;
};
os_descs : 
{
    use = 0;
    qw_sign = "";
    b_vendor_code = 0x0;
};
strings = ( 
    {
        lang = 0x409;
        manufacturer = "Foo Inc.";
        product = "Bar Gadget";
        serialnumber = "0123456789";
    } );
functions : 
{
    uac2_usb0 : 
    {
        instance = "usb0";
        type = "uac2";
        attrs : 
        {
            c_chmask = 3;
            c_srate = 44100;
            c_ssize = 4;
            p_chmask = 3;
            p_srate = 44100;
            p_ssize = 4;
        };
        os_descs = ( );
    };
};
configs = ( 
    {
        id = 1;
        name = "The only one";
        attrs : 
        {
            bmAttributes = 0x80;
            bMaxPower = 0x2;
        };
        strings = ( 
            {
                lang = 0x409;
                configuration = "1xUAC2";
            } );
        functions = ( 
            {
                name = "some_name";
                function = "uac2_usb0";
            } );
    } );
